{
 "clusters": {
  "LysR_ModE": {
   "anchors": [
    {
     "accession": "A0A080JC06",
     "accessions": [
      "A0A080JC06",
      "A0A0E0Y5K5",
      "A0A0E1LWN8",
      "A0A0E1SXX3",
      "A0A0H3EER5",
      "A0A0H3MN15",
      "A0A0H3PPY3",
      "A0A192CJM8",
      "A0A1S9J3I0",
      "A0A1S9KEN3",
      "A0A1X3I9D3",
      "A0A1X3J424",
      "A0A1X3JKZ0",
      "A0A235UGU3",
      "A0A4P7TSI9",
      "A0A4P8C8Q0",
      "A0A6H2GGP0",
      "A0A7M3S3R1",
      "A0A7U9AW79",
      "A0A7U9J2A0",
      "A0A7U9LXV2",
      "A0A7Z8GJ24",
      "A0A822PC17",
      "A0A829L499",
      "A0A836NG42",
      "A0A891SH06",
      "A0A979GDS1",
      "A0A9P2I9N1",
      "A0A9P2LT23",
      "A0A9Q6UXT8",
      "A7ZJD6",
      "B7LAG3",
      "B7MPP6",
      "B7NA04",
      "C3TIA7",
      "D2A9C5",
      "D6I7P6",
      "D6J876",
      "D8ADD3",
      "E0J4G1",
      "E1IVS5",
      "F4TBW9",
      "F4UZW7",
      "F4VBI5",
      "F5NQP8",
      "P0A9G8",
      "P0A9G9",
      "P0A9H0",
      "Q0T6Z1",
      "S1FF55",
      "U9XGJ9",
      "V0A686",
      "W1ET38",
      "W1WZL3"
     ],
     "evidence_grade": "literature",
     "evidence_level": "experimental",
     "inducer": "molybdate",
     "n_accessions": 54,
     "n_operators": 19,
     "n_regulon_genes": 46,
     "name": null,
     "organism": "Escherichia coli 1-250-04_S3_C2",
     "seq_md5": "0b06eab3efde23ce54d4f3d54d8c0318",
     "source_route": "kb+figure"
    }
   ],
   "confidence_tier": "tentative (single anchor)",
   "conflict": false,
   "inducer_consensus": "MoO42-",
   "n_accession_rows": 54,
   "n_anchors": 1,
   "n_distinct_inducers": 1,
   "n_independent_anchors": 1
  },
  "LysR_c1": {
   "anchors": [
    {
     "accession": "P52690",
     "accessions": [
      "P52690"
     ],
     "evidence_grade": "literature",
     "evidence_level": "experimental",
     "inducer": "CO2",
     "n_accessions": 1,
     "n_operators": 4,
     "n_regulon_genes": 0,
     "name": null,
     "organism": "Cereibacter sphaeroides",
     "seq_md5": "7358ceeafdc75144476b485be57fdbd3",
     "source_route": "kb"
    },
    {
     "accession": "A0A164ULY5",
     "accessions": [
      "A0A164ULY5",
      "A0A6H0H884",
      "A0A6M3ZHM0",
      "P39647"
     ],
     "evidence_grade": "literature",
     "evidence_level": "experimental",
     "inducer": null,
     "n_accessions": 4,
     "n_operators": 2,
     "n_regulon_genes": 2,
     "name": null,
     "organism": "Bacillus subtilis",
     "seq_md5": "2bf7e6e0fe2afb0a43f32fa1e10dff6d",
     "source_route": "kb"
    },
    {
     "accession": "A0A077ZKR4",
     "accessions": [
      "A0A077ZKR4",
      "A0A080IRE5",
      "A0A0A0FCV7",
      "A0A0E0Y0D3",
      "A0A0E1LZ60",
      "A0A0E1T553",
      "A0A0E2L4V3",
      "A0A0H2Z0L6",
      "A0A0H3EIY6",
      "A0A0H3MI03",
      "A0A0H3PTI5",
      "A0A0H7PWL1",
      "A0A140N8K1",
      "A0A192C9E2",
      "A0A1X3J0C8",
      "A0A1X3JE38",
      "A0A1X3L1D2",
      "A0A1X3LZN0",
      "A0A380ABY4",
      "A0A403A2I8",
      "A0A454A5N0",
      "A0A4P8BY86",
      "A0A6H2GQ09",
      "A0A7I6H4V9",
      "A0A7U9AY83",
      "A0A7U9LX34",
      "A0A7U9NZN8",
      "A0A7W4KJM6",
      "A0A826KVM5",
      "A0A836NB50",
      "A0A8E0FR88",
      "A0A8E0MIX0",
      "A0A8E2M210",
      "A0A8H9AEJ3",
      "A0A979GG69",
      "A0A9P2MJZ5",
      "A0A9P2QXJ6",
      "A0A9P2SY12",
      "A0A9P2TJS7",
      "A0A9Q6Y2R3",
      "A0A9Q6ZGR6",
      "A7ZNY1",
      "B1LKQ4",
      "B7LAI0",
      "B7MF72",
      "B7MXH1",
      "B7UFH3",
      "C3T3W8",
      "D7XHA9",
      "D7Y4R3",
      "D8E7J0",
      "E1IJH5",
      "E1JDS8",
      "E6BKC2",
      "E9TA71",
      "F4NE55",
      "F4SZW8",
      "F4TIC8",
      "F4V3U8",
      "F4VHC6",
      "F5NX84",
      "P0ACR4",
      "P0ACR5",
      "P0ACR6",
      "Q1R9R4",
      "Q3Z049",
      "S1EIX0",
      "S1PVV3",
      "U9XGZ7",
      "U9YUQ6",
      "V0A3S1",
      "V0SIQ4",
      "V0UXV3",
      "V0XZ02",
      "W1EXE1"
     ],
     "evidence_grade": "computational",
     "evidence_level": "experimental",
     "inducer": null,
     "n_accessions": 75,
     "n_operators": 0,
     "n_regulon_genes": 15,
     "name": null,
     "organism": "Trichuris trichiura",
     "seq_md5": "cc3e6fb6928dbf30678f50efdfaf37a0",
     "source_route": "kb"
    }
   ],
   "confidence_tier": "high (3 consistent anchors)",
   "conflict": false,
   "inducer_consensus": "CO2",
   "n_accession_rows": 80,
   "n_anchors": 3,
   "n_distinct_inducers": 1,
   "n_independent_anchors": 3
  },
  "LysR_c2": {
   "anchors": [
    {
     "accession": "A0A080I908",
     "accessions": [
      "A0A080I908",
      "A0A0A0FB35",
      "A0A0E0Y724",
      "A0A0E1M4F2",
      "A0A0E1SYQ9",
      "A0A0E2KYC2",
      "A0A0H3ESJ8",
      "A0A0H3MTH1",
      "A0A0H3PYS9",
      "A0A140NF57",
      "A0A236BGB9",
      "A0A2S8DGF8",
      "A0A398U1R0",
      "A0A3T2URM4",
      "A0A454AA51",
      "A0A4P8C8W7",
      "A0A564U3R9",
      "A0A5R8RCS3",
      "A0A6H2GK63",
      "A0A6N3QDX0",
      "A0A6N3QVP2",
      "A0A7I6HB70",
      "A0A7U9IUE1",
      "A0A7U9LW29",
      "A0A7W4KM11",
      "A0A826LAH4",
      "A0A828U1A8",
      "A0A829G3S1",
      "A0A836N8Q8",
      "A0A891SM03",
      "A0A8E0FQ99",
      "A0A8E0IVV5",
      "A0A979GJ68",
      "A0A9P2IDU0",
      "A0A9P2R2Q4",
      "A0A9P2TFM4",
      "A0A9P2WIP2",
      "A0A9Q6Y5J1",
      "A0A9Q6ZJL2",
      "A0A9Y1GLX0",
      "A7ZUI1",
      "B1LNS1",
      "B2TWF6",
      "B7LA63",
      "B7MI99",
      "B7MR54",
      "B7NFR1",
      "B7UNT9",
      "C3SIJ2",
      "D3GS18",
      "D6IGN7",
      "E0J688",
      "E9XV09",
      "I2UCE5",
      "I6CDN1",
      "I6DG22",
      "L4IUG4",
      "P0ACQ4",
      "P0ACQ5",
      "P0ACQ6",
      "Q31U27",
      "Q32AB4",
      "S1ES85",
      "S1PK88",
      "W1F6V4"
     ],
     "evidence_grade": "literature",
     "evidence_level": "experimental",
     "inducer": "H2O2",
     "n_accessions": 65,
     "n_operators": 87,
     "n_regulon_genes": 45,
     "name": null,
     "organism": "Escherichia coli 1-250-04_S3_C2",
     "seq_md5": "01f7ef453121c0bb818ead6a5da9a2b6",
     "source_route": "kb+figure"
    },
    {
     "accession": "A0A071KTW5",
     "accessions": [
      "A0A071KTW5",
      "A0A0H2ZI92",
      "A0A1C7BBD1",
      "A0A346FBA4",
      "A0A3S4N0U6",
      "A0A6N0KV73",
      "A0A9E8RFX7",
      "A0A9Q9JZ83",
      "Q9HTL4"
     ],
     "evidence_grade": "literature",
     "evidence_level": "experimental",
     "inducer": null,
     "n_accessions": 9,
     "n_operators": 92,
     "n_regulon_genes": 0,
     "name": null,
     "organism": "Pseudomonas aeruginosa",
     "seq_md5": "935590f0a244a1c748ceaae8427e68fb",
     "source_route": "kb"
    },
    {
     "accession": "A0A0U5F9E2",
     "accessions": [
      "A0A0U5F9E2",
      "A0A1D9EM68",
      "A0A6M2WQH5",
      "A0A7S6YYR9",
      "A0A9X6BLY3",
      "M4U7P6",
      "Q8PNY3"
     ],
     "evidence_grade": "literature",
     "evidence_level": "experimental",
     "inducer": null,
     "n_accessions": 7,
     "n_operators": 1,
     "n_regulon_genes": 0,
     "name": null,
     "organism": "Xanthomonas citri pv. citri",
     "seq_md5": "de748861c3216411b7e4547b9dbca633",
     "source_route": "kb"
    },
    {
     "accession": "A0A087I947",
     "accessions": [
      "A0A087I947",
      "A0A3Q0L1Y8",
      "Q7MNH7"
     ],
     "evidence_grade": "literature",
     "evidence_level": "experimental",
     "inducer": null,
     "n_accessions": 3,
     "n_operators": 0,
     "n_regulon_genes": 0,
     "name": null,
     "organism": "Vibrio vulnificus",
     "seq_md5": "d45f46c021a17c2c34e4b95abf1cd15b",
     "source_route": "kb"
    },
    {
     "accession": "A0A173H870",
     "accessions": [
      "A0A173H870",
      "A0A179R2I9",
      "A0A2I0CJ76",
      "A0A2K4LSE4",
      "A0A2L0T5X8",
      "A0A2L1IEK2",
      "A0A2V4F2A5",
      "A0A7L9GJR0",
      "A5WB26",
      "I3UV78",
      "I7CD59",
      "Q88C74"
     ],
     "evidence_grade": "omics",
     "evidence_level": "experimental",
     "inducer": null,
     "n_accessions": 12,
     "n_operators": 3,
     "n_regulon_genes": 0,
     "name": null,
     "organism": "Pseudomonas sp. JY-Q",
     "seq_md5": "1e32ee6a6c9f1be81463b44b838fc3a4",
     "source_route": "kb"
    }
   ],
   "confidence_tier": "high (5 consistent anchors)",
   "conflict": false,
   "inducer_consensus": "H2O2",
   "n_accession_rows": 96,
   "n_anchors": 5,
   "n_distinct_inducers": 1,
   "n_independent_anchors": 5
  }
 },
 "family": "LysR-type (LTTR)",
 "family_tag": "LysR",
 "generated": "2026-08-30 23:16",
 "source": "analysis/family_kb"
}