{
 "clusters": {
  "NikR_c1": {
   "anchors": [
    {
     "accession": "A1YSQ9",
     "accessions": [
      "A1YSQ9",
      "B5Z8Y5",
      "V6L668"
     ],
     "evidence_grade": "literature",
     "evidence_level": "experimental",
     "inducer": "Ni",
     "n_accessions": 3,
     "n_operators": 22,
     "n_regulon_genes": 0,
     "name": "hpNikR",
     "organism": "Helicobacter pylori",
     "seq_md5": "292dbe5df648b6845fe27a2975ff73eb",
     "source_route": "kb+figure"
    },
    {
     "accession": "A0A080IJ23",
     "accessions": [
      "A0A080IJ23",
      "A0A090NHH3",
      "A0A0A0FGH5",
      "A0A0E0XUF5",
      "A0A0E1M4H5",
      "A0A0E1SY23",
      "A0A0E2L072",
      "A0A0H3EN31",
      "A0A0H3PVI5",
      "A0A0I1BIR1",
      "A0A0K9TE28",
      "A0A140N4M3",
      "A0A192CCZ1",
      "A0A1S9K539",
      "A0A1X3IV26",
      "A0A1X3JBM2",
      "A0A1X3JQ32",
      "A0A1X3KXH0",
      "A0A1X3LCY5",
      "A0A1X3LQ09",
      "A0A2T3RTH1",
      "A0A432L062",
      "A0A4P7TSK9",
      "A0A4P8BWL2",
      "A0A5F1F3E2",
      "A0A5F1HXY1",
      "A0A6D2X1R0",
      "A0A6H2GM39",
      "A0A6N3QS47",
      "A0A6N3QXV3",
      "A0A7U9FTZ5",
      "A0A7U9IVC9",
      "A0A7U9LTF1",
      "A0A7W4KKP8",
      "A0A822PL58",
      "A0A826L2U9",
      "A0A829KWY5",
      "A0A836Z9T9",
      "A0A891SN69",
      "A0A8E0FIP0",
      "A0A8E0IWW1",
      "A0A8E2SAA0",
      "A0A914XY74",
      "A0A9P2LS76",
      "A0A9P2MKQ6",
      "A0A9P2WHN4",
      "A0A9P2WTQ8",
      "A0A9Q6V263",
      "A0A9Q7EBN9",
      "A0A9X0TUP0",
      "A0A9X1GZ94",
      "A0A9X6EKH1",
      "A1AH17",
      "A7ZT19",
      "A8A5T9",
      "B1EHS0",
      "B1J0E9",
      "B1X7T9",
      "B2U4B0",
      "B5YUQ6",
      "B7L5T4",
      "B7M2P4",
      "B7MDX1",
      "B7N1R9",
      "B7NEA8",
      "B7NN95",
      "C3SP37",
      "C4ZW30",
      "D2A9S8",
      "D3H0B6",
      "D6IF34",
      "D6JGD1",
      "D7XW33",
      "D7XZD4",
      "D8E7U5",
      "E0IZN9",
      "E1IP83",
      "E1JCA5",
      "E2X8T5",
      "E6BIP4",
      "E9XT18",
      "F4NNK4",
      "F4T526",
      "F4TLP5",
      "F4V7H5",
      "F4VKC1",
      "F5P2V0",
      "G7YYF2",
      "I2UK37",
      "I6CAT2",
      "I6DML6",
      "L4IY30",
      "P0A6Z6",
      "P0A6Z7",
      "P0A6Z8",
      "P0A6Z9",
      "Q0SZJ2",
      "Q1R5D7",
      "Q31VE5",
      "Q32AQ0",
      "Q3YW47",
      "S1E910",
      "S1PMA7",
      "U9XPL7",
      "U9Y2C1",
      "U9ZNP6",
      "V0ADR3",
      "V0V4R1",
      "V0YLM1",
      "W1WMG1"
     ],
     "evidence_grade": "literature",
     "evidence_level": "experimental",
     "inducer": "Ni2+",
     "n_accessions": 110,
     "n_operators": 2,
     "n_regulon_genes": 6,
     "name": null,
     "organism": "Escherichia coli 1-250-04_S3_C2",
     "seq_md5": "6d977bb96b25187abc5348661bf9f009",
     "source_route": "kb"
    },
    {
     "accession": "A0A832W6V5",
     "accessions": [
      "A0A832W6V5",
      "O58316"
     ],
     "evidence_grade": "literature",
     "evidence_level": "experimental",
     "inducer": "Ni2+",
     "n_accessions": 2,
     "n_operators": 0,
     "n_regulon_genes": 0,
     "name": null,
     "organism": "Pyrococcus horikoshii",
     "seq_md5": "767c6d87c57292b49c58b26fbca9cb3a",
     "source_route": "kb"
    },
    {
     "accession": "A0A024BX50",
     "accessions": [
      "A0A024BX50",
      "A0A1V3AKS3",
      "A0A1Y3E2V9",
      "J0AJ69",
      "J0D3B2",
      "J0QJZ1",
      "K2KNP7",
      "O25896",
      "T2SRG4",
      "V5NM23"
     ],
     "evidence_grade": "literature",
     "evidence_level": "experimental",
     "inducer": null,
     "n_accessions": 10,
     "n_operators": 19,
     "n_regulon_genes": 0,
     "name": null,
     "organism": "Helicobacter pylori J166",
     "seq_md5": "3511eec241e31e9b2a97c555498f3eac",
     "source_route": "kb"
    },
    {
     "accession": "D3UIX2",
     "accessions": [
      "D3UIX2"
     ],
     "evidence_grade": "literature",
     "evidence_level": "experimental",
     "inducer": null,
     "n_accessions": 1,
     "n_operators": 4,
     "n_regulon_genes": 0,
     "name": null,
     "organism": "Helicobacter mustelae (strain ATCC 43772 / LMG 18044 / NCTC 12198 / 12198)",
     "seq_md5": "9d9119ecb2e3fab6748aab911511e0e8",
     "source_route": "kb"
    }
   ],
   "confidence_tier": "high (5 consistent anchors)",
   "conflict": false,
   "inducer_consensus": "Ni2+",
   "n_accession_rows": 126,
   "n_anchors": 5,
   "n_distinct_inducers": 1,
   "n_independent_anchors": 5
  }
 },
 "family": "NikR",
 "family_tag": "NikR",
 "generated": "2026-08-30 23:16",
 "source": "analysis/family_kb"
}