{
 "clusters": {
  "Rrf2_ecIscR": {
   "anchors": [
    {
     "accession": "A0A080IRI1",
     "accessions": [
      "A0A080IRI1",
      "A0A090NGA5",
      "A0A0E0XX77",
      "A0A0E1M0C0",
      "A0A0E1SWD7",
      "A0A0E2L340",
      "A0A0H3EJU2",
      "A0A0H3PW81",
      "A0A140N8Z3",
      "A0A192CAX7",
      "A0A1H0LAI0",
      "A0A1Q8MIQ0",
      "A0A1Q8MX00",
      "A0A1X3I429",
      "A0A1X3J2B8",
      "A0A1X3JF30",
      "A0A1X3L0R7",
      "A0A2A2XHV7",
      "A0A2S7SN49",
      "A0A370VAB8",
      "A0A4P7TNC2",
      "A0A4P8C0X4",
      "A0A5F1I071",
      "A0A6H2GP42",
      "A0A6N3QRV3",
      "A0A7U9AUC2",
      "A0A7U9DIU0",
      "A0A7U9QIU1",
      "A0A7W4KK14",
      "A0A7Z8DZ79",
      "A0A822PJA5",
      "A0A828U3I5",
      "A0A829L9K8",
      "A0A891SNR6",
      "A0A8E0FPL4",
      "A0A9P2GFE9",
      "A0A9Q6UXN5",
      "A1AE68",
      "A7ZPX5",
      "B1LNI7",
      "B1XB06",
      "B2TXV6",
      "B5Z105",
      "B7LDC3",
      "B7LJQ3",
      "B7MIM1",
      "B7MYG4",
      "B7N6B8",
      "B7NRI0",
      "B7UGX7",
      "C3SZN7",
      "C4ZXA6",
      "D2AGX6",
      "D3H3P1",
      "D6I9W7",
      "D6JD05",
      "D7XMW7",
      "D8AEG8",
      "E0J4M9",
      "E1J3L1",
      "E2X5S9",
      "E6BGV6",
      "F4T212",
      "F4THL0",
      "F5NY36",
      "I6DW88",
      "P0AGK8",
      "P0AGK9",
      "P0AGL0",
      "P0AGL1",
      "Q0T1Y8",
      "Q0TEV4",
      "Q1R8K1",
      "Q31XV9",
      "Q32D33",
      "S1PX21",
      "U9YRX4",
      "V0W9Y2",
      "W1X7P9"
     ],
     "evidence_grade": "literature",
     "evidence_level": "experimental",
     "inducer": "Fe2+",
     "n_accessions": 79,
     "n_operators": 15,
     "n_regulon_genes": 33,
     "name": null,
     "organism": "Escherichia coli 1-250-04_S3_C2",
     "seq_md5": "de6f99239b4941ac1360cd737b466eb9",
     "source_route": "kb"
    },
    {
     "accession": "A0A072ZQG4",
     "accessions": [
      "A0A072ZQG4",
      "A0A0H2ZFC9",
      "A0A1C7BSD5",
      "A0A3S4MLR9",
      "A0A6N0KPI4",
      "A0A9Q9N317",
      "A6V0U7",
      "Q9HXI7"
     ],
     "evidence_grade": "literature",
     "evidence_level": "experimental",
     "inducer": null,
     "n_accessions": 8,
     "n_operators": 7,
     "n_regulon_genes": 0,
     "name": null,
     "organism": "Pseudomonas aeruginosa",
     "seq_md5": "1df965c74fe08cf678ff5c2716a1800a",
     "source_route": "kb"
    }
   ],
   "confidence_tier": "high (2 consistent anchors)",
   "conflict": false,
   "inducer_consensus": "Fe2+",
   "n_accession_rows": 87,
   "n_anchors": 2,
   "n_distinct_inducers": 1,
   "n_independent_anchors": 2
  },
  "Rrf2_saCymR": {
   "anchors": [
    {
     "accession": "A0A0D1L3Y8",
     "accessions": [
      "A0A0D1L3Y8",
      "A0A2M8SZX7",
      "A0A410WNR7",
      "A0A6H0H9C8",
      "A0A6H0WNT5",
      "A0A6M3ZIS9",
      "A0A7G7UH78",
      "A0A7G9PIP7",
      "A0A8E0SC27",
      "A0A9Q2LNQ2",
      "A0A9Q4E9G8",
      "A0A9Q4ENY5",
      "A0A9W5LK50",
      "E0TUK3",
      "G4NY86",
      "O34527"
     ],
     "evidence_grade": "literature",
     "evidence_level": "experimental",
     "inducer": "Cumate",
     "n_accessions": 16,
     "n_operators": 19,
     "n_regulon_genes": 8,
     "name": null,
     "organism": "Bacillus subtilis",
     "seq_md5": "0e6a555c3399b9bf19c5f08dff954f20",
     "source_route": "kb+figure"
    },
    {
     "accession": "A0A077VL70",
     "accessions": [
      "A0A077VL70",
      "A0A0D1J251",
      "A0A0E1X4U1",
      "A0A0H2WW89",
      "A0A0H2XJ48",
      "A0A0H3JRR0",
      "A0A0H3JUF7",
      "A0A0H3K0F1",
      "A0A0H3K8V5",
      "A0A7U7EVG1",
      "A0A7U7JV34",
      "A0A7Z7W340",
      "A0A8D9SKQ1",
      "A0A9P3ZEJ5",
      "A0A9Q2YKU9",
      "T1YB66"
     ],
     "evidence_grade": "literature",
     "evidence_level": "experimental",
     "inducer": null,
     "n_accessions": 16,
     "n_operators": 0,
     "n_regulon_genes": 0,
     "name": null,
     "organism": "Staphylococcus schweitzeri",
     "seq_md5": "f6990fbc6b0ba7b4b6fa5b599f26bc25",
     "source_route": "kb"
    },
    {
     "accession": "A0A7U8HGL4",
     "accessions": [
      "A0A7U8HGL4",
      "Q92BJ8"
     ],
     "evidence_grade": "literature",
     "evidence_level": "experimental",
     "inducer": null,
     "n_accessions": 2,
     "n_operators": 0,
     "n_regulon_genes": 0,
     "name": null,
     "organism": "Listeria monocytogenes",
     "seq_md5": "a1aa567d1290cfca8554df434b4a0e04",
     "source_route": "kb"
    }
   ],
   "confidence_tier": "high (3 consistent anchors)",
   "conflict": false,
   "inducer_consensus": "cumate",
   "n_accession_rows": 34,
   "n_anchors": 3,
   "n_distinct_inducers": 1,
   "n_independent_anchors": 3
  },
  "Rrf2_scNsrR": {
   "anchors": [
    {
     "accession": "A0A7K2URZ6",
     "accessions": [
      "A0A7K2URZ6",
      "Q9L132"
     ],
     "evidence_grade": "literature",
     "evidence_level": "experimental",
     "inducer": "Fe2+",
     "n_accessions": 2,
     "n_operators": 0,
     "n_regulon_genes": 0,
     "name": null,
     "organism": "Streptomyces sp. SID7813",
     "seq_md5": "5a06ad6b94fbf6080d058bddb95c8f9a",
     "source_route": "kb+figure"
    }
   ],
   "confidence_tier": "tentative (single anchor)",
   "conflict": false,
   "inducer_consensus": "Fe2+",
   "n_accession_rows": 2,
   "n_anchors": 1,
   "n_distinct_inducers": 1,
   "n_independent_anchors": 1
  },
  "Rrf2_svRsrR": {
   "anchors": [],
   "confidence_tier": "unknown (no ground-truth evidence)",
   "conflict": false,
   "inducer_consensus": null,
   "n_accession_rows": 0,
   "n_anchors": 0,
   "n_distinct_inducers": 0,
   "n_independent_anchors": 0
  },
  "Rrf2_tpIscR": {
   "anchors": [],
   "confidence_tier": "unknown (no ground-truth evidence)",
   "conflict": false,
   "inducer_consensus": null,
   "n_accession_rows": 0,
   "n_anchors": 0,
   "n_distinct_inducers": 0,
   "n_independent_anchors": 0
  }
 },
 "family": "Rrf2",
 "family_tag": "Rrf2",
 "generated": "2026-08-30 23:16",
 "source": "analysis/family_kb"
}